|Mesaerion: The Best Science Fiction Stories 1800-1849|
Join
|William Shakespeare's Star Wars: Verily, A New Hope (William Shakespeare's Star Wars #4)|
|The Project|
|Soft Apocalypse|
|Sleeping Giants (Themis Files #1)|
Arena
|Foundation (Foundation (Publication Order) #1)|
|The Restaurant at the End of the Universe (Hitchhiker's Guide to the Galaxy #2)|
|Ready Player One|
|Life, the Universe and Everything (Hitchhiker's Guide to the Galaxy #3)|
|Dune (Dune #1)|
|Do Androids Dream of Electric Sheep? (Blade Runner #1)|
|Three Wishes (River of Time: California #1)|
|The Last Girl (The Dominion Trilogy #1)|
|Having the Barbarian's Baby (Ice Planet Barbarians #7.5)|
