|The Coming Woman: A Novel Based on the Life of the Infamous Feminist, Victoria Woodhull|
|The Boys in the Boat: Nine Americans and Their Epic Quest for Gold at the 1936 Berlin Olympics|
|Starving Hearts (Triangular Trade Trilogy, #1)|
|America's Cradle of Quarterbacks: Western Pennsylvania's Football Factory from Johnny Unitas to Joe Montana|
|Aladdin and His Wonderful Lamp|
|Penny Maybe|
|Maude (1883-1993):She Grew Up with the country|
|The Inefficiency Assassin: Time Management Tactics for Working Smarter, Not Longer|
|Soul Reader|
Bossypants
|A World of Flavor: Your Gluten Free Passport|
|A Piece of Sky, a Grain of Rice: A Memoir in Four Meditations|
|Tracing Numbers on a Train|
|Thirteen Reasons Why|
|The Secret (The Secret #1)|
|The Psychopath Test: A Journey Through the Madness Industry|
|The Kite Runner|
|The Girl on the Train|
|The Emerald Mystery|
|The Bridge to Consciousness: I'm Writing the Bridge Between Science and Our Old and New Beliefs.|
|The Art of War|
|Secrets and Lace (Fatal Hearts #1)|
|Romero and Juliet: A Tragic Tale of Love and Zombies|
|Poses for Artists Volume 1 - Dynamic and Sitting Poses: An Essential Reference for Figure Drawing and the Human Form|
|Miss Peregrine�s Home for Peculiar Children (Miss Peregrine�s Peculiar Children #1)|
|Large Print Heart of the Pride|
Grumbles
|First Steps for New Christians (Print Edition)|
|Eureka Trivia 6.0|
|Drive: The Surprising Truth About What Motivates Us|
|Done Rubbed Out (Reightman & Bailey #1)|caqcazcaqcaazcacaczac
|Beauty Restored (Riley Family Legacy Novellas #3)|
|Ayumi's Violin|
Anonymous
|Amy Meets the Saints and Sages|
Amatus
|V for Vendetta (V for Vendetta Complete)|
|Unbroken: A World War II Story of Survival, Resilience, and Redemption|
|The Wright Brothers|
|The Songs of the Gods|
|The Rosie Projecdadat (Don Tillman #1)|
|The Power of Habit: Why We Do What We Do in Life and Business|
|Steve Jobs|
|Luckiest Girl Alive|
|Living Leadership by Insight: A Good Leader Achieves, a Great Leader Builds Monuments|
|Lady Midnight (The Dark Artifices #1)|
|Hush, Hush (Hush, Hush #1)|
|Greek Mythic History|
|Every Last Word|
|Daily Fantasy Sports|
|Clockwork Angel (The Infernal Devices #1)|
|City of Fallen Angels (The Mortal Instruments #4)|
|City of Bones (The Mortal Instruments #1)|
|City of Ashes (The Mortal Instruments #2)|
|Carry On, Warrior: Thoughts on Life Unarmed|
Carrie
|Angels & Demons (Robert Langdon #1)|
|The Three Searches, Meaning, and the Story|
|Raspberry Pi Electronics Projects for the Evil Genius|
|How to Speak Golf: An Illustrated Guide to Links Lingo|
|Eleanor & Park|
|Troublemaker: Surviving Hollywood and Scientology|
Adultery
|Unlimited Intuition Now|
|Underlying Notes|
|The New Brand You: Your New Image Makes the Sale for You|
|The Flowers Lied|
|NaNo What Now? Finding your editing process, revising your NaNoWriMo book and building a writing career through publishing and beyond|
|Modern Day Fables|
|The Unlikely Pilgrimage of Harold Fry (Harold Fry #1)|
|The Martian (The Martian #1)|
|Left Behind (Left Behind #1)|
|John Vassos: Industrial Design for Modern Life|
|I'll Give You the Sun|
|Heaven is for Real: A Little Boy's Astounding Story of His Trip to Heaven and Back|
|Ender's Game (The Ender Quintet #1)|
|Death by Leisure: A Cautionary Tale|
|Wildlife of New York: A Five-Borough Coloring Book|
|The Year of Living Biblically: One Man's Humble Quest to Follow the Bible as Literally as Possible|
|The Great Gatsby|
|The Good Girl|
|The 7 Habits of Highly Effective People: Powerful Lessons in Personal Change|
|Steal Like an Artist: 10 Things Nobody Told You About Being Creative|
|Life of Pi|
|The Sound Of Love|
|The Perks of Being a Wallflower|
|The Makings of a Fatherless Child|
|The Hobbit (Middle-Earth Universe)|
|The Fellowship of the Ring (The Lord of the Rings #1)|
|Ship Leaves Harbor: Essays on Travel by a Recovering Journeyman|
|Musicophilia: Tales of Music and the Brain|
|What If?: Serious Scientific Answers to Absurd Hypothetical Questions|
|The Fault in Our Stars|
|The Dream Thieves (The Raven Cycle #2)|
|The 5th Wave (The 5th Wave #1)|
|Shiver (The Wolves of Mercy Falls #1)|
|Remember Me?|
|If I Stay (If I Stay #1)|
|I Know Why the Caged Bird Sings (Maya Angelou's Autobiography #1)|
|Harry Potter and the Deathly Hallows (Harry Potter #7)|
|Fool Me Once|
Drama
|Blue Lily, Lily Blue (The Raven Cycle #3)|
|Alight (The Generations Trilogy #2)|
|Vogue Colors A to Z: A Fashion Coloring Book|
|The Shining (The Shining #1)|
|The Hunger Games (The Hunger Games #1)|
|Outlander (Outlander #1)|
|Mockingjay (The Hunger Games #3)|
|Harry Potter and the Sorcerer's Stone (Harry Potter #1)|
|Confessions of a Shopaholic (Shopaholic #1)|
|Zero History (Blue Ant #3)|
|World War Z: An Oral History of the Zombie War|
|Wild: From Lost to Found on the Pacific Crest Trail|
|Where'd You Go, Bernadette|
|Twilight (Twilight #1)|
|The Paris Wife|
|The Maze Runner (The Maze Runner #1)|
|The Lover's Dictionary|
|The Goldfinch|
|The Giver (The Giver Quartet #1)|
|The Girl Who Played with Fire (Millennium Trilogy #2)|
|The Demon-Haunted World: Science as a Candle in the Dark|
|The Book Thief|
|The Autobiography of Malcolm X|
|Shopaholic & Baby (Shopaholic #5)|
|Quiet: The Power of Introverts in a World That Can't Stop Talking|
|Packing for Mars: The Curious Science of Life in the Void|
|Orange Is the New Black|
|One for the Money (Stephanie Plum #1)|
|Morning Star (Red Rising #3)|
|Life After Life|
|Lean In: Women, Work, and the Will to Lead|
|Is Everyone Hanging Out Without Me? (And Other Concerns)|
|Gone Girl|
Fellside
|Eclipse (Twilight #3)|
Dracula
|Dead Wake: The Last Crossing of the Lusitania|
|David and Goliath: Underdogs, Misfits, and the Art of Battling Giants|
